Trait,Gene,Source,Product,Function
Sulfonylurea herbicide tolerance,surB,Nicotiana tabacum,herbicide tolerant acetolactate synthase (ALS) enzyme,confers tolerance to sulfonylurea herbicides and other acetolactate synthase (ALS) inhibiting herbicides
Sulfonylurea herbicide tolerance,zm-hra,Zea mays,herbicide tolerant acetolactase synthase (als) enzyme,confers tolerance to acetolactate synthase-inhibiting herbicides such as sulfonylurea and imidazolinone
Viral disease resistance,ac1 (sense and antisense),Bean Golden Mosaic Virus (BGMV),sense and antisense RNA of viral replication protein (Rep); no functional viral replication protein is produced,"inhibits the synthesis of the viral replication protein of the Bean Golden Mosaic Virus (BGMV), thereby conferring resistance to the BGMV"
Viral disease resistance,cmv_cp,Cucumber Mosaic Cucumovirus (CMV),coat protein of cucumber mosaic cucumovirus (CMV),"confers resistance to cucumber mosaic cucumovirus (CMV) through ""pathogen-derived resistance"" mechanism"
Viral disease resistance,plrv_orf1,Potato Leaf Roll Virus (PLRV),putative replicase domain of the potato leaf roll virus  (PLRV),confers resistance to potato leaf roll virus (PLRV) through gene silencing mechanism
Viral disease resistance,plrv_orf2,Potato Leaf Roll Virus (PLRV),putative helicase domain of the potato leaf roll virus (PLRV),confers resistance to potato leaf roll virus (PLRV) through gene silencing mechanism
Viral disease resistance,ppv_cp,Plum pox virus (PPV),coat protein of plum pox virus (PPV),"confers resistance to plum pox virus (PPV) through ""pathogen-derived resistance"" mechanism"
Viral disease resistance,prsv_cp,Papaya ringspot virus (PRSV),coat protein (CP) of the papaya ringspot virus (PRSV),"confers resistance to papaya ringspot virus (PRSV) through ""pathogen-derived resistance"" mechanism"
Viral disease resistance,prsv_rep,Papaya ringspot virus (PRSV),replicase domain of the papaya ringspot virus (PRSV),confers resistance to papaya ringspot virus (PRSV) through gene silencing mechanism
Viral disease resistance,pvy_cp,Potato Virus Y (PVY),coat protein of the potato virus Y (PVY),"confers resistance to potato virus Y (PVY) through ""pathogen-derived resistance"" mechanism"
Viral disease resistance,wmv_cp,Watermelon Mosaic Potyvirus 2 (WMV2),coat protein of watermelon mosaic potyvirus 2 (WMV2),"confers resistance to watermelon mosaic potyvirus 2 (WMV2) through ""pathogen-derived resistance"" mechanism"
Viral disease resistance,zymv_cp,Zucchini Yellow Mosaic Potyvirus (ZYMV),coat protein of zucchini yellow mosaic potyvirus (ZYMV),"confers resistance to zucchini yellow mosaic potyvirus (ZYMV) through ""pathogen-derived resistance"" mechanism"
Visual marker,dsRed2,Discosoma sp.,red fluorescent protein,"produces red stain on transformed tissue, which allows visual selection"
Visual marker,uidA,Escherichia coli,beta-D-glucuronidase (GUS) enzyme,"produces blue stain on treated transformed tissue, which allows visual selection"
Volumetric Wood Increase,cel1,Arabidopsis thaliana,CEL1 recombinant protein,promotes a faster growth
